{
  "$schema": "https://json-schema.org/draft/2020-12/schema",
  "$id": "https://fair2.ai/schemas/fair2-cert/v1.4.0",
  "title": "FAIR² Certification Credential (fair2-cert.json)",
  "description": "A W3C Verifiable Credential (VC Data Model 2.0) asserting the FAIR² certification status of one exact package version. Referenced from the Certification pointer node inside fair2.json via fair2:certificationDocument. See docs/specification/certification.md.",
  "type": "object",
  "required": ["@context", "type", "issuer", "validFrom", "credentialSubject", "credentialStatus", "proof"],
  "additionalProperties": false,
  "properties": {
    "@context": {
      "description": "The VC 2.0 context first, then the FAIR² context.",
      "type": "array",
      "minItems": 2,
      "prefixItems": [
        { "const": "https://www.w3.org/ns/credentials/v2" },
        { "type": "string", "pattern": "^https://fair2\\.ai/context/v[0-9]+(\\.[0-9]+){0,2}(\\.jsonld)?$" }
      ]
    },
    "id": { "type": "string", "format": "uri" },
    "type": {
      "type": "array",
      "minItems": 2,
      "prefixItems": [
        { "const": "VerifiableCredential" },
        { "const": "FAIR2CertificationCredential" }
      ]
    },
    "issuer": {
      "description": "The certifier's DID. Must appear in the authorised-certifier registry with authority spanning validFrom.",
      "type": "string",
      "pattern": "^did:(web|key):[A-Za-z0-9._:%-]+$"
    },
    "validFrom": {
      "description": "Issuance date. Certifier authority is checked at this date, not at verification time.",
      "type": "string",
      "format": "date-time"
    },
    "validUntil": {
      "description": "Not permitted. Decision C binds a certification to a package version, not to the calendar; it ends by revocation or by the package changing.",
      "not": {}
    },
    "credentialSubject": { "$ref": "#/$defs/CredentialSubject" },
    "credentialStatus": { "$ref": "#/$defs/StatusListEntry" },
    "proof": { "$ref": "#/$defs/DataIntegrityProof" }
  },
  "$defs": {
    "CredentialSubject": {
      "type": "object",
      "required": ["id", "conformsTo", "metadataVersion", "digestMultibase",
                   "graphDigestMultibase", "fair2ComplianceLevel", "certificationScope"],
      "additionalProperties": false,
      "properties": {
        "id": {
          "description": "The certified dataset, by DOI URL. Matches the @id of the fair2.json.",
          "type": "string", "format": "uri"
        },
        "certifiedDocument": {
          "description": "URL of the exact fair2.json the digests were taken over. The metadata document, not a governance document of the same filename.",
          "type": "string", "format": "uri"
        },
        "conformsTo": {
          "description": "The FAIR² spec version validated against.",
          "type": "string", "pattern": "^https://fair2\\.ai/spec/v[0-9]+\\.[0-9]+\\.[0-9]+$"
        },
        "metadataVersion": {
          "description": "fair2:metadataVersion of the certified document — the document's own version, not the dataset's.",
          "type": "string", "pattern": "^[0-9]+\\.[0-9]+\\.[0-9]+$"
        },
        "digestMultibase": {
          "description": "Multibase multihash (sha2-256) of the published bytes. Checked first.",
          "$ref": "#/$defs/Multibase"
        },
        "graphDigestMultibase": {
          "description": "Multibase multihash (sha2-256) of the RDFC-1.0 canonical n-quads. Checked only if the byte digest fails; a match means equivalent, not identical.",
          "$ref": "#/$defs/Multibase"
        },
        "fair2ComplianceLevel": {
          "enum": ["fair2:Certified", "fair2:Validated"]
        },
        "certificationScope": {
          "description": "What was checked. A scope omitting dataIntegrity must be rendered as \"FAIR²-Certified (metadata only)\".",
          "type": "array", "minItems": 1, "uniqueItems": true,
          "items": { "$ref": "#/$defs/ScopeToken" }
        },
        "validationReport": { "type": "string", "format": "uri" }
      }
    },
    "StatusListEntry": {
      "description": "Revocation. There is no expiry to check.",
      "type": "object",
      "required": ["id", "type", "statusPurpose", "statusListIndex", "statusListCredential"],
      "properties": {
        "id": { "type": "string", "format": "uri" },
        "type": { "const": "BitstringStatusListEntry" },
        "statusPurpose": { "const": "revocation" },
        "statusListIndex": { "type": "string", "pattern": "^[0-9]+$" },
        "statusListCredential": { "type": "string", "format": "uri" }
      }
    },
    "DataIntegrityProof": {
      "type": "object",
      "required": ["type", "cryptosuite", "created", "verificationMethod", "proofPurpose", "proofValue"],
      "properties": {
        "type": { "const": "DataIntegrityProof" },
        "cryptosuite": { "const": "eddsa-jcs-2022" },
        "created": { "type": "string", "format": "date-time" },
        "verificationMethod": {
          "description": "A method in the issuer DID document's assertionMethod.",
          "type": "string", "pattern": "^did:(web|key):[A-Za-z0-9._:%-]+#.+$"
        },
        "proofPurpose": { "const": "assertionMethod" },
        "proofValue": { "type": "string", "pattern": "^z[1-9A-HJ-NP-Za-km-z]+$" }
      }
    },
    "ScopeToken": {
      "enum": ["metadataConformance", "dataIntegrity", "licenseVerification",
               "processAttestation", "temporalProof"]
    },
    "Multibase": {
      "description": "Multibase 'u' (base64url, unpadded) over a multihash. 0x12 0x20 is sha2-256.",
      "type": "string",
      "pattern": "^u[A-Za-z0-9_-]+$"
    }
  }
}
