{
  "@context": [
    "https://www.w3.org/ns/credentials/v2",
    "https://fair2.ai/context/v1.4.0"
  ],
  "id": "https://sen.science/certifications/10.71728/r1rj-f947/fair2-cert.json",
  "type": [
    "VerifiableCredential",
    "FAIR2CertificationCredential"
  ],
  "issuer": "did:web:sen.science",
  "validFrom": "2026-04-16T09:30:00Z",
  "credentialSubject": {
    "id": "https://doi.org/10.71728/r1rj-f947",
    "certifiedDocument": "https://sen.science/doi/10.71728/r1rj-f947/fair2.json",
    "conformsTo": "https://fair2.ai/spec/v1.4.0",
    "metadataVersion": "1.0.0",
    "digestMultibase": "uEiDixlVqFfWrgYrq6dQttW6sa336WgzxLL3YxsyIxAFsYQ",
    "graphDigestMultibase": "uEiCdaRhI_cl636VHp2O5fmXhaTiciRWa40UiHLMl5JoVAQ",
    "fair2ComplianceLevel": "fair2:Certified",
    "certificationScope": [
      "metadataConformance",
      "dataIntegrity",
      "licenseVerification",
      "processAttestation"
    ],
    "validationReport": "https://sen.science/certifications/10.71728/r1rj-f947/report.json"
  },
  "credentialStatus": {
    "id": "https://sen.science/certifications/status/1#4812",
    "type": "BitstringStatusListEntry",
    "statusPurpose": "revocation",
    "statusListIndex": "4812",
    "statusListCredential": "https://sen.science/certifications/status/1"
  },
  "proof": {
    "type": "DataIntegrityProof",
    "cryptosuite": "eddsa-jcs-2022",
    "created": "2026-04-16T09:30:00Z",
    "verificationMethod": "did:web:sen.science#z6MkrJVnaZkeFzdQyMZu1cgjg7k1pZZ6pvBQ7XJPt4swbTQ2",
    "proofPurpose": "assertionMethod",
    "proofValue": "z3FXQjecWufY46yg5abdVZsXqLhxkb8fS8TRgvDbNHJMtyEmjVBdTBhhXfF1rUcFVvJ4Vg1Kk3cZTFgPnPcTKvYx"
  }
}
